{
  "source": "perseus-greek",
  "runId": "2026-06-26T03-51-33.680Z",
  "retrievedAt": "2026-06-26T03:51:40.378Z",
  "license": "CC BY-SA 3.0",
  "url": "https://www.perseus.tufts.edu/hopper/",
  "suggestions": [
    {
      "id": "hades",
      "field": "greek",
      "value": "Ἅδης",
      "confidence": 0.9,
      "provenance": {
        "source": "perseus-greek",
        "recordId": "https://services.perseids.org/bsp/morphologyservice/analysis/word?lang=grc&word=%E1%BC%8D%CE%B9%CE%B4%CE%B7%CF%82&engine=morpheusgrc",
        "retrievedAt": "2026-06-26T03:51:36.738Z",
        "url": "https://services.perseids.org/bsp/morphologyservice/analysis/word?lang=grc&word=%E1%BC%8D%CE%B9%CE%B4%CE%B7%CF%82&engine=morpheusgrc",
        "license": "CC BY-SA 3.0"
      },
      "note": "Perseus lemma (noun, masculine) differs from current greek field"
    }
  ]
}
